[
    {
      "feature": "ML_MIN",
      "properties": {},
      "rank": 5,
      "actions": [
        {
          "action": "TEXT_BOX",
          "properties": {
            "title": "{DATE}",
            "message": "The worst accuracy: ${MEAN_TRAIN_ACCURACY}% [${MEAN_TRAIN_ACCURACY}%]",
            "backgroundColor": "#d3d3d3",
            "width": 300
          }
        }
      ]
    },
    {
      "feature": "ML_MAX",
      "properties": {},
      "rank": 7,
      "actions": [
        {
          "action": "TEXT_BOX",
          "properties": {
            "message": "The best accuracy: ${MEAN_TRAIN_ACCURACY}% [${MEAN_TRAIN_ACCURACY}%]",
            "title": "{DATE}",
            "backgroundColor": "#d3d3d3",
            "width": 300
          }
        }
      ]
    },
    {
      "feature": "ML_CURRENT",
      "properties": {},
      "rank": 7,
      "actions": [
        {
          "action": "TEXT_BOX",
          "properties": {
            "message": "The current testing accuracy: ${MEAN_TRAIN_ACCURACY}% [${MEAN_TRAIN_ACCURACY}%]",
            "title": "{DATE}",
            "backgroundColor": "#d3d3d3",
            "width": 300
          }
        }
      ]
    },
    {
      "feature": "ML_LAST",
      "properties": {},
      "rank": 7,
      "actions": [
        {
          "action": "TEXT_BOX",
          "properties": {
            "message": "The current/last testing accuracy: ${MEAN_TRAIN_ACCURACY}% [${MEAN_TRAIN_ACCURACY}%]",
            "title": "{DATE}",
            "backgroundColor": "#d3d3d3",
            "width": 300
          }
        }
      ]
    }
  ]
  