[
  {
    "feature": "FIRST",
    "properties": {},
    "rank": 10,
    "actions": [
      {
        "action": "TEXT_BOX",
        "properties": {
          "title": "${date}",
          "message": "Region ${name} recorded its first COVID-19 case.",
          "backgroundColor": "#d3d3d3",
          "width": 200
        }
      }
    ]
  },

  {
    "feature": "PEAK",
    "properties": {},
    "rank": 10,
    "actions": [
      {
        "action": "TEXT_BOX",
        "properties": {
          "title": "${date}",
          "message": "By ${date}, the number of cases reached peak, ${value} in region ${name}.",
          "backgroundColor": "#d3d3d3",
          "width": 200
        }
      },
      {
        "action": "DOT",
        "properties": {
          "color": "#FFA500",
          "size": 5,
          "opacity": 0.6
        }
      },
      {
        "action": "CIRCLE",
        "properties": {
          "size": 10,
          "strokeWidth": 2,
          "opacity": 0.6,
          "color": "#FFA500"
        }
      },
      {
        "action": "CONNECTOR",
        "properties": {
          "stroke": "black",
          "opacity": 0.6
        }
      }
    ]
  },
  {
    "feature": "SLOPE",
    "properties": {
      "gt": 10
    },
    "rank": 6,
    "actions": [
      {
        "action": "TEXT_BOX",
        "properties": {
          "message": "By ${date}, the number of cases continued to climb higher. Let us all make a great effort to help bring the number down. Be safe and support the NHS.",
          "title": "${date}",
          "backgroundColor": "#d3d3d3",
          "width": 300
        }
      },
      {
        "action": "CONNECTOR",
        "properties": {}
      }
    ]
  },
  {
    "feature": "SLOPE",
    "properties": {
      "lte": -10
    },
    "rank": 6,
    "actions": [
      {
        "action": "TEXT_BOX",
        "properties": {
          "message": "By ${date}, the number of cases dropped noticeably. Excellent effort. Be safe and support the NHS",
          "title": "${date}",
          "backgroundColor": "#d3d3d3",
          "width": 300
        }
      },
      {
        "action": "CONNECTOR",
        "properties": {}
      }
    ]
  },
  {
    "feature": "SLOPE",
    "properties": {
      "gt": -10,
      "lt": 10
    },
    "rank": 3,
    "actions": [
      {
        "action": "TEXT_BOX",
        "properties": {
          "message": "By ${date}, the number of cases dropped noticeably. Excellent effort. Be safe and support the NHS",
          "title": "${date}",
          "backgroundColor": "#d3d3d3",
          "width": 300
        }
      },
      {
        "action": "CONNECTOR",
        "properties": {}
      }
    ]
  },
  {
    "feature": "SLOPE",
    "properties": {
      "gt": 15
    },
    "rank": 5,
    "actions": [
      {
        "action": "TEXT_BOX",
        "properties": {
          "message": "The number of cases grew",
          "title": "${date}",
          "backgroundColor": "#d3d3d3",
          "width": 200
        }
      },
      {
        "action": "CONNECTOR",
        "properties": {}
      }
    ]
  },
  {
    "feature": "SLOPE",
    "properties": {
      "lt": -15
    },
    "rank": 5,
    "actions": [
      {
        "action": "TEXT_BOX",
        "properties": {
          "message": "By ${date}, the number of cases came down noticeably. We should continue to be vigilant.",
          "title": "${date}",
          "backgroundColor": "#d3d3d3",
          "width": 300
        }
      },
      {
        "action": "CONNECTOR",
        "properties": {}
      }
    ]
  },
  {
    "feature": "MAX",
    "properties": {},
    "rank": 5,
    "actions": [
      {
        "action": "DOT",
        "properties": {
          "color": "red",
          "size": 5,
          "strokeWidth": 2,
          "opacity": 0.6
        }
      },
      {
        "action": "CIRCLE",
        "properties": {
          "size": 10,
          "strokeWidth": 2,
          "opacity": 0.6,
          "color": "red"
        }
      },
      {
        "action": "TEXT_BOX",
        "properties": {
          "title": "${date}",
          "message": "On ${date}, the number of cases reached maximum, ${value} in region ${name}.",
          "backgroundColor": "#d3d3d3",
          "width": 300
        }
      },
      {
        "action": "CONNECTOR",
        "properties": {
          "stroke": "black",
          "opacity": 0.6
        }
      }
    ]
  }
]
